"PN60: <HT01 First Name> I thought we had, uh, established a bond of honesty uh, I  told you about the girl coming here, she came, I'm not lying to you about anything, the guy has a heart problem. [pause] Is there any  way that she could uh, contact him by telephone? [pause] That would  help us out a great deal if you could do that.",1,,,,,,,,other: reason and self-consistency,1,0
"HT01: Sure, if you can patch us through, hell we've got communication  through out world, patch her through and let her talk to him. [  ] enable her for right now.  [pause, distant conversation, unable to.understand].",,,,,,,,,,0,0
PN60: See em' about that.,,,,,,,,,,0,0
"CH31: Understands, I just think he's a little nervous right now, but try to reassure <CH31 Husband's First Name> until I can talk to him, that I'm okay.",,,,,,,,,,0,0
"PN60: Okay <CH31 First Name>, I'll do that. [pause] <PN60 First Name> to <HT01 First Name>. [pause] <PN60 First Name> to  the Captain.",,,,,,,,,,0,0
"CH30: Yea, this is Captain <CH30 Last Name>.",,,,,,,,,,0,0
PN60: Have you received your food yet?,,,,,,,,,,0,0
"CH30: Yea we got it, but uh, what's left, not steak and eggs, that'll do  uh, I can uh, pretty much assure the, the girl in there, uh <ON82 First Name>, that uh, if she would come out here and talk to him this whole  thing would be over in five minutes.",,,1,,,,,,Pilot persuading FBI agent: if you just let him talk to her it will be over in 5 minutes,1,1
"PN60: <PN60 First Name> to uh, <HT01 First Name>.",,,,,,,,,,0,0
"CH31: Uh, <HT01 First Name> doesn't wanna talk.",,,,,,,,,,0,0
"PN60: Okay, let me talk to [radio cut out].  [pause, distant talk in the back ground, can't pick up on it].",,,,,,,,,,0,0
"CH30: Uh, like I said I think [radio cut out] [ ] out here and talk to him uh, we'd be all be off the airplane here in about five minutes.",,,1,,,,,,Pilot persuading FBI agent: if you just let him talk to her it will be over in 5 minutes,1,1
PN60: I have to talk to <HT01 First Name> for a minute please. [pause] <PN60 First Name> to <HT01 First Name>.,,,,,,,,,,0,0
"CH31: Uh, this is <CH31 First Name> can you [radio cut out]. [long pause] he's got relatives there, I hope so.",,,,,,,,,,0,0
PN60: <PN60 First Name> to Captain <CH30 Last Name>.,,,,,,,,,,0,0
"CH30: Yea, go ahead.",,,,,,,,,,0,0
"PN60: Okay uh, tell uh, <HT01 First Name> that I'm going to talk to <ON82 First Name> and I'll be off the air for just a minute, okay.",,,,,,,,,,0,0
"CH30: Okay, that's fine.  [pause]",,,,,,,,,,0,0
"PN61: Step down for just a second, and he's gonna be coming right back,  okay. I'll get a message to him that you wanna talk to him. Is everybody still okay?",,,,,,,,,,0,0
"HT01: Number one stept out, that's two negotiator's down, uh, your the  third. Come on <PN61 First Name>, I'm gonna let you talk to the co-pilot, I'm gonna let you know everything's okay on flight <NUMBER>.",,,,,,,,,,0,0
"PN61: Okay, <HT01 First Name> I'm sure everything's okay, I'm just checkin', you  called us, I just wanted to make sure everything was still going alright. <PN60 First Name> ull be back in the plane in just a minute.  [pause]",,,,,,,,,,0,0
PN60: <PN60 First Name> to <HT01 First Name>.,,,,,,,,,,0,0
HT01: Come in <PN60 First Name>.,,,,,,,,,,0,0
"PN60: Hello there <HT01 First Name>, ha listen uh, how are we doing now?",,,,,,,,,,0,0
"HT01: You tell me, I'm on the inside, you on the outside lookin' in, you  tell me how we're doin' <PN60 First Name>, uh, I control the [  ] goin' to this plane, everyone's happy, uh, we're sittin here, I've had me a  couple uh, I've had me two half sandwiches, the pilot drank his  I witness 13WMAZTB maken milk, 8oz. The co-pilot has to use the rest room, she's more than welcome to go use the rest room anytime she wants to, we're not holding her back, uh, you tell me how the  hell are things goin' on the outside <PN60 First Name>?",,,,,,,,,,0,0
"PN60: Okay, I appreciate that update uh, things are going fine here uh, I  understand that you talked to my partner a little bit uh, <PN61 First Name>. [pause] <HT01 First Name>.  <PN60 First Name> to <HT01 First Name>.",,,,,,,,,,0,0
"HT01: <HT01 First Name>, come in <PN60 First Name>, I've told you a thousand times. Call me  <HT01 First Name> or call me <Nickname>, come on, get it right if you don't mind.",,,,,,,,,,0,0
"PN60: Okay, I don't like <HT01 First Name> myself. Listen, I understand that you were  talking to my partner about the bomb a little bit, and I need to know uh, you know uh, tell me a little bit about this thing.",,,,,,,,,,0,0
"HT01: Okay, I'll tell you exactly how a bomb works, it works off of a  little bitty battery, like a celular battery that you have in your calculator, or a cellular battery that you have in your digital  watch. The battery and liner are in the, it runs through my back,  through my legs and connects to my bag, and that little spark, it only takes a spark to let it go.",,,,,,,,,,0,0
"PN60: Okay, don't let me cut you off, go ahead.",,,,,,,,,,0,0
HT01: <PN60 First Name>.,,,,,,,,,,0,0
PN60: How did you make that thing?,,,,,,,,,,0,0
"HT01: <PN60 First Name>, I didn't make it, it was given to me. It was a gift.",,,,,,,,,,0,0
"PN60: <HT01 First Name>, your telling me that somebody gave you the bomb?",,,,,,,,,,0,0
"HT01: <PN60 First Name>, I'm telling you somebody gave me the explosives to blow this  fuckin' plane up if I want to, I've got fifty more sticks in the whole.",,,,,,,,,,0,0
PN60: Your tellin' me you have fifty more sticks of dynamite in the whole  of the plane?,,,,,,,,,,0,0
"HT01: Negatory. I have them hiden somewhere, I've only got five sticks in my bag, only, well as a matter of fact I've only got three, I left two in my motel room.",,,,,,,,,,0,0
"PN60: Okay, let me ask you this. When things work out, how do you  propose to, to disarm the bomb and to take the wires off you and stuff.",,,,,,,,,,0,0
"HT01: All I do is remove the battery from myself, keep it out of my  reach, take the battery, chuck it out the fuckin' window, whatever I want to do with it, just keep it away from the bomb, take and pull the fuses out of the end of the dynomite and walk off the  plane. Let's face it, you coulda' slinged out of my own apartment, I can throw a stick out there if I want to, it's not  gonna explode unless it has somethin' causing it to explode, it's  very powerful though.",,,,,,,,,,0,0
"PN60: Okay, well why don't we get uh, started on doing that uh, before we  do let me ask you this now. Everybody has a boss, right? Okay. My boss has told me that your gonna have to, to uh, show some good  faith in this matter if you would uh, we've got the girl, we've  talked to your mother, we, we have her coming down here. We're asking you to let the, the girl just walk off the plane, and as  soon as you do that we can uh, bring <ON82 First Name> out, okay. [pause]  <HT01 First Name> are you listening to me?",,,1,,,,2,,commitment: let her go; authority: my boss says you have to do this,1,1
"HT01: The girl, <CH31 First Name> is come off the plane right now. Go.",,,,,,,,,,0,0
"PN60: Okay, that's good.  [long pause, radio static]",,,,,,,,,,0,0
"PN60: [static] really appreciate that, and what I wanna do, try in get  some help for you. [pause] I wanna do something for you, that's what I'm saying, because you've done something for me and uh, I  really appreciate that, okay.",,,,,1,,,,I appreciate that,1,1
"HT01: Affirmative, I let all hostages except for one off the plane, uh, I  let the whole damn slue, I coulda' taken two kids with me, two uh, two females, and about three males with me to begin with, I let em'  all off except for the pilot and co-pilot off, now I let the  co-pilot off due to the fact that her husband is uh, goin' through colonary problems, um, under complete control and I've met your circumstances, you have a boss, I've met your circumstances boss  uh, your bosses circumstances. Now tell me what the hell your gonna do for me?",,1,,,,,,,"I did you a favor, now what are you gonna do for me?",1,1
"PN60: Okay, this is what I'm gonna do for you, I know that you wanted to  uh, see <ON82 First Name>, and I know that you want to get out of there and everything is gonna be alright, so here's what I wanna do, here's  the way I would like to conclude the thing. First of all, I wanna  know from you, what doctor that you wanna see, that's very important to me that uh, I want you, I want you to get the type of  care that you want, so you tell me that please.",,,,,1,,,,it's important to me that you get the proper care,1,1
"HT01: I'm not really sure, because my own doctor's my family doctor has  uh, distrusted me uh, the doctors in Athens have got me strung out on barbs. before, the one's in Augusta really [radio cut out] doctor I wannna see, I wanna know if I need psychiatric care and  [radio cut out].",,,,,,,,,,0,0
"PN60: I can promise you this, that uh, you will definitely get psychiatric  help uh, what I'd like to do now is to proceed on with uh, with bringing <ON82 First Name> within your vision, so that you can see her, then you  can disarm [radio cut out] okay, now listen here's the way we wanna  do it uh, the first thing I want you to do is to go ahead and  disarm the bomb uh, I'll have her in your vision, stay in radio  contact with me, that's very important. [pause] Okay, you follow  me so far <HT01 First Name>? [long pause] <PN60 First Name> to <HT01 First Name>.",,,1,,,,,,here’s how I want it to go down,1,1
HT01: Come in <PN60 First Name>.,,,,,,,,,,0,0
"PN60: Okay, did you read me so far my friend?",,,,,1,,,,friend,1,1
"HT01: 10-4 and I said negatory, I've met as far as your demands as I'm  gonna met uh, meet. Now I want my demands met, I've met yours and I'm more, I've been more than glad to meet them. I could have  taken every person on this plane hostage and I didn't, the only  person on here is me and <CH30 First Name>, me and <CH30 First Name> are the only people on here. I respect <CH30 First Name>, and I don't want <CH30 First Name> to go up with me,  I'll go up by myself, I would leave him first before I'd go up  by myself, I'll go up by myself before I let uh, before I'd disarm  my bomb.",,1,,,,,,,where's the favor repayment?,1,1
PN60: <PN60 First Name> to <HT01 First Name>.,,,,,,,,,,0,0
"HT01: Meet my demands, I don't through my fuckin' bag out the window,  the whole bag, <CH30 First Name>'s seen the bag, <CH30 First Name> can tell you if I've went in the bag or not, I'm gonna through it out my right passenger  side window, if you are willing to grant me what I want.",,,1,,,,,,meet my demands and I will give up,1,1
"PN60: Okay <HT01 First Name> uh, tell me again, slowly please, tell me exactly what  you want again, I've done almost everything that you want, jus, tell me again slowly please. [pause] <PN60 First Name> to <HT01 First Name>.",,,,,,,,,,0,0
"CH30: Uh, <PN60 First Name> this is <CH30 First Name>, uh, Captain <CH30 Last Name> uh, he wants you to uh,  bring <ON82 First Name> down here just uh, within vision and at that time, I'll, he'll uh, do-somethin' else for ya and he said he'd through the bag  out the window just, uh, to it as long as he can see her.",,,1,,,,,,meet my demands and I will give up,1,1
"PN60: Okay, just stand by for a minute. [long pause]",,,,,,,,,,0,0
PN60: <PN60 First Name> to Captain <CH30 Last Name>.,,,,,,,,,,0,0
"CH30: Yea, go ahead.",,,,,,,,,,0,0
"PN60: Okay, can <HT01 First Name> hear me now, I hope he can because I need to uh, to  relay something to him, okay.",,,,,,,,,,0,0
"CH30: Yea, he can hear ya.",,,,,,,,,,0,0
"PN60: <ON82 First Name> has agreed to uh, to uh, to come out and to, to be in his  vision, but the main thing is this. <HT01 First Name> has requested some help, we want [radio cut out] come off the plane, but its even more  important to me that he gets the help that he needs. Over.",,,,,1,,,,it's important to me that he gets help,1,1
"CH30: Okay, let me talk to him real fast and get everything straight so  we don't have to talk back and forth.",,,,,,,,,,0,0
"PN60: Okay, that's good. You get right back to me please.",,,,,,,,,,0,0
CH30: Okay.  [pause],,,,,,,,,,0,0
"CH30: And ah, <PN60 First Name>, Captain <CH30 Last Name>.",,,,,,,,,,0,0
"PN60: This is <PN60 First Name>, go ahead Captain.",,,,,,,,,,0,0
"CH30: Okay uh, I think we've reached an agreement, what uh, he would  [radio cut out].",,,,,,,,,,0,0
"PN60: Okay uh, what we'd like for him to do is just uh, uh, just leave  the bag on the airplane and uh, we'll get uh, get <ON82 First Name> in position right now and uh, as soon as we do I'll get back in contact with  you and at that time, I'd like for both of you to walk out [radio  cut out].  [pause]",,,1,,,,,,here’s the deal,1,1
"PN60: <HT01 First Name> if you would, why he wants to see <ON82 First Name> please, he's talked to  her in the cockpit, I mean ah, she's here, she's waiting on him to walk off the plane, would you ask him that please, that's very  important to us.",,,1,,,,,,here’s the deal,1,1
HT01: <PN60 First Name>.,,,,,,,,,,0,0
PN60: Yea <HT01 First Name>.,,,,,,,,,,0,0
"HT01: An I'm waitin' recogonize someone that I fuckin' know, if you can't  understand that, you can't understand my fuckin' demands, I'm tired of fuckin' deal with you, okay God Damnit!",,,,,,,,,,0,0
"PN60: Uh <HT01 First Name>, let's just, just settle down for a minute, I understand  that, uh, all I was asking is to find out, now that I know, fine, there's no problem. I just wanna know son, okay.",,,,,1,,,,familiarity (son),1,1
"CH30: Yea, everything ill be fine, just uh, just have her come down in  front that [  ] truck and once he see's her uh, we'll both get off the airplane, and that'll be the end of it. I think he just  wants to be assured that uh, she is uh, definately here and he can  recognize her and uh, and uh, the way he feels with her uh, being  out there, she'll may look after him and order to uh, get him the  uh, help that he needs.",,,1,,,,,,here's the deal,1,1
"PN60: Uh, okay just stand by for a minute because I have to consult with  my superiors, I can't make this decision, just hold on for a second and uh, and we'll see what happens, okay Captain?",,,,,,,1,,bosses have to clear that,1,1
CH30: Okay.  [pausej,,,,,,,,,,0,0
HT01: <PN60 First Name>.,,,,,,,,,,0,0
PN60: Yea <HT01 First Name>.,,,,,,,,,,0,0
"HT01: Why did you ask me to do somethin' uh, ask me to do somethin' that  you know you can't do, I'm tired of you fuckin' bargain me, I've bargained to the point of no return. There's no fuckin' bargain,  all bargain has been stopped, you've got my god damn demands all  communications are stopped. 10-4!  [pause]",,,,,,,,,,0,0
ON80: [  ] batch on ID 27 Roger uh.,,,,,,,,,,0,0
PN60: <PN60 First Name> to <HT01 First Name>. [pause] This is <PN60 First Name> to <HT01 First Name>.  [pause],,,,,,,,,,0,0
PN60: This is <PN60 First Name> to <HT01 First Name>.,,,,,,,,,,0,0
"CH30: Yea, this is Captain <CH30 Last Name>, I don't think he wants to talk to ya  anymore until uh, he see's her out here. [pause]",,,,,,,,,,0,0
"PN60: Okay, would you mind relaying this to uh, <HT01 First Name> please uh, ask him  uh, as soon as uh, as we uh, show him to <ON82 First Name>, I would like very much to have him let you walk down the ramp and walk off the plane  and there after uh, I'd like him to walk down. Over.",,,1,,,,,,"if I show her to you,let the pilots go",1,1
"HT01: That's negatory, I'll walk down with the pilot, we'll go arm and  arm.",,,,,,,,,,0,0
"PN60: <HT01 First Name> I have promised you. I have promised you that nothing will  happen to you, I've promised you that. I'm very concerned about you, and I'm very concerned about the Captain and I want you to  listen to me if you will. All I want you to do is to walk off the  plane, walk off the plane with the Captain, that's fine. Okay,  will you do that for me right now?",2,,,,1,,,,other: self-consitency; liking: I am concerned,1,1
HT01: Do What!,,,,,,,,,,0,0
"PN60: I will show you <ON82 First Name>, all I want you to do is to walk off the plane  and then we can talk eyeball to eyeball, okay'?",,,1,,,,,,here's the deal,1,1
"HT01: As I said if my demands are not met, I'm gonna blow this son-of-a-bitch up, I'm gonna head it towards you. Take your fuckin' choice <PN60 First Name>'  [pause]",,,1,,,,,,if you don’t meet my demands I will blow up the plane,1,1
"CH30: Uh, <PN60 First Name> from Captain <CH30 Last Name>.",,,,,,,,,,0,0
"PN60: Yea, this is <PN60 First Name>, go ahead.",,,,,,,,,,0,0
"CH30: Uh, listen <PN60 First Name> uh, [radio cut out] situation here since I'm uh,  right here with him uh, I can guarantee you that uh, if you just put her out in front of the truck and uh, we both walk off and  leave the bag on, nothin's gonna happen.",,,1,,,,,,take the deal FBI,1,1
"PN60: [radio out] Captain because uh, we're discussing the matter right  now, there's alot to be taken into consideration uh, just stand by uh, we're working on [radio cut out].",,,,,,,,,,0,0
"HT01: [radio out] I could use some fuckin' steak and eggs, the only thing  you brought me was shitty ass ham and cheese, I haven't talked to anybody but <ON82 First Name>, but, but just one second, you haven't even told  me were my mom is, you told me that you were in contact with her  and as soon as you got in touch, contact with her that she was bein' planed this way, I'm tired of you bullshittin' with me <PN60 First Name>.",,,,,,,,,,0,0
"PN60: Let me put <ON82 First Name> back on to talk to you. Just hold on for a second,  I'll get her back over here, okay.",,,,,,,,,,0,0
HT01: Can look your way.,,,,,,,,,,0,0
PN60: What.,,,,,,,,,,0,0
"HT01: I'll take my god damn ouzi, and I'll fuck you up.",,,,,,,,,,0,0
"PN60: Ha <HT01 First Name>, <ON82 First Name> is headed over to the position that you wanted her  to, take your time [radio cut out].",,,,,,,,,,0,0
"HT01: How long does it take you four fuckin' hours to do somethin' like  this, that's the reason our governments in control with a bunch of fuck heads like you, runnin' the son-of-a-bitch <PN60 First Name>.",,,,,,,,,,0,0
PN60: We're gonna work everything [radio cut out]. Can you see her yet?,,,,,,,,,,0,0
"CH30: Uh, that's a negative.",,,,,,,,,,0,0
"PN60: Okay, we're tryin' to work her into proper positions so that uh,  [radio cut out] Captain, I'm sure that you can understand our position uh, I'm very concerned about <HT01 First Name>, I'm very concerned  about concerned about, I want uh, I want <HT01 First Name> to get the help that he  needs. [pause] <PN60 First Name> to Captain <CH30 Last Name>, can you read me?  yourself and uh, an all that we're trying to [radio cut out]  mother is in route down here uh, I'm working on the uh, fact that  uh, uh, hold on for one [radio cut out] I've just been told that  we're getting uh, doctors here and help will be available for him  when he comes off the plane, and this is really what I was",,,,,1,,,,concern,1,1
"CH30: Yea, we got ya uh, like I say everything will be fine here, this,  soon as she get's down here and we'll be both walkin' off.",,,,,,,,,,0,0
"PN60: Okay Captain, I appreciate your hanging in there with us because  I'm sure that you understand our problem it's just that uh, we wanna make sure that everybody gets off the plane alright, that's  very important to us uh, just bare with us and everything will be  fine, son.",,,,,,,,,,0,0
CH30: Yea I understand I've uh [  ] necessary.,,,,,,,,,,0,0
HT01: What is goin' on?,,,,,,,,,,0,0
"PN60: <PN60 First Name> to <HT01 First Name>, go ahead.",,,,,,,,,,0,0
HT01: What is going on God Damnit?,,,,,,,,,,0,0
PN60: <PN60 First Name> to <HT01 First Name>.,,,,,,,,,,0,0
"CH30: Yea, this is Captain <CH30 Last Name>, go ahead. [pause]",,,,,,,,,,0,0
PN60: This is <PN60 First Name> to <HT01 First Name>,,,,,,,,,,0,0
"CH30: Uh, <PN60 First Name> this is Captain <CH30 Last Name>, go ahead. [pause]",,,,,,,,,,0,0
PN60: This is <PN60 First Name> to <HT01 First Name>.,,,,,,,,,,0,0
"CH30: Yea, we hear ya <PN60 First Name>, uh. [pause]",,,,,,,,,,0,0
PN60: This is <PN60 First Name> to <HT01 First Name>.,,,,,,,,,,0,0
"CH30: Yea, <PN60 First Name> go ahead we can hear ya.",,,,,,,,,,0,0
"PN60: Okay, this is <PN60 First Name> to <HT01 First Name>.",,,,,,,,,,0,0
"CH30: Uh, we gotcha, go ahead. [background interference]",,,,,,,,,,0,0
PN60: <PN60 First Name> to Captain <CH30 Last Name>.,,,,,,,,,,0,0
"CH30: Yea, go ahead. [pause]",,,,,,,,,,0,0
"CH30: And any word <PN60 First Name> on the, if it [radio cut out].",,,,,,,,,,0,0
"HT01: I fuckin' met my moral obligations to you and to the fuckin'  democratic society we live in, and god damnit I've asked for two fuckin' simple demands and you haven't met um yet [  ] wait to  be kind to you, keep fuckin'.",,,,,,,,,,0,0
"PN60: We done is this, you've asked for four demands, and I've met two of  them, I'm working on the other two right now, all you have to do is to continue to trust me and I'll have those worked out.  [pause]",1,,,,,,,,self-consistency,1,0
PN60: This is <PN60 First Name> to <HT01 First Name>.,,,,,,,,,,0,0
"HT01: Go <PN60 First Name>, Go!",,,,,,,,,,0,0
"PN60: Okay, listen <HT01 First Name> just, just settle down for a minute, I want you  to know that I have to go over and talk to my boss for just a second, just a few minutes and, and I'll be right back to you and  then we can have this thing resolved, please, please wait on me  okay?",,,,,,,1,,I need to talk to my boss so please give me some time,1,1
"HT01: Let me tell you somethin' <PN60 First Name>, I've been within, I've been sittin' here. I hijacked this plane at approximately uh, hijacked it 9 11.2 noticle miles before we got here. I replaced the time at approximately 11:30, now, it is now 3:15, I'm tired of fuckin' doin', I'm givin' you to fuckin' 4:00, your fuckin' times runnin'  out buddy, you got 43 fuckin' minutes as the clock struck twelve  just then, 43 fuckin' minutes to met, meet my demands, have my mother standin' out there by that fuckin' thing and have <ON82 First Name>  standin' out there, I'll get off this fuckin' plane, and I'll walk  off here with this Captain, otherwise I'll blow the son-of-a-bitch  up. You got it <PN60 First Name>, that's your, that's my fuckin', you go  toward either phones now buddy.",,,,,,,,,,0,0
"PN60: Okay <HT01 First Name>, I understand my friend but uh, I assure you that you'll  have just what you want and we'll have <ON82 First Name> by the plane and uh, we can go ahead and work it out. So I'm gonna sign off right now and  I'll be back to you shortly.",,,,,1,,,,friend,1,1
"HT01: That's a negatory! I told you I want my mother there at 2:00, I  gave you two, I told you two hours ago I ask about her, where the fuck is she buddy?",,,,,,,,,,0,0
"PN60: She's in Athens as you very well know and she's on her way here,  we're trying to bring her here by, by helicopter as I've told you I'm, I'm trying to uh, work on one demand at a time uh, you just  told me about wanting your mother physically here and I'm trying to  get her here.",1,,,,,,,,reason why his mother isn’t here yet,1,0
"HT01: I'll tell you what, that fuckin' white car you just brought up  there, you didn't bring <ON82 First Name> in it, you lied to me, this is the second one up there, there's a lot, a yellow one drivin' out of the  way, keep lookin' pushin' um, keep pushin' um, bring um a little  closer, bring um within bomb range, bring um within bomb range.  Dig it.",,,,,,,,,,0,0
"PN60: Ha <HT01 First Name> let's just settle down for a minute, and let's just you and  I talk for a minute, that's the only way that we can get anything accomplished is to communicate with each other uh, your a little  bit excited right now, I am too, but I wanna see you, I wanna talk  to you face to face, okay?",1,,,,,,,,reason,1,0
"HT01: I'm tired of meetin' your demands <PN60 First Name>, I went as far as I can go,  you've got mine, I want to see my mama and I want to see <ON82 First Name> out there by the damn fuel truck, when I see them, I'll walk over, off  this son-of-a-bitch with the pilot, keep pushin' your god damn  safety men, keep pushin' um a little closer, keep tryin' to get um  within position and your gonna fuck up, your gonna blow the whole  god damn thing up, promise me.",,,,,,,,,,0,0
"PN60: <HT01 First Name> listen, I want you to know that everybody wants you to get off that plane out there. I've spoken with uh, with my boss and I have to go back and talk to him again, so just stand by and I'll get right back to you.",,,,,,,1,,need to talk to my boss again,1,1
PN61: <PN61 First Name> to Captain.,,,,,,,,,,0,0
"CH30: Yea, understand that uh, he's just gettin' tired of uh, waitin' and gettin' tired of seein' all these other cars uh, pull up by the other uh, yellow and uh, yellow vehicles out here.",,,,,,,,,,0,0
"PN61: Okay, tell <HT01 First Name> that we're gonna work on gettin' those cars back where he wanted them, get that word out there, we're still workin' on everything that he wanted, <PN60 First Name>s goin' to talk to some people right now, the one thing that we want <HT01 First Name> to understand is that we are working on this and we're doin' our best to get the situation resolved so that everybody can come out safetly, okay.",1,,,,,,,,reason,1,0
"HT01: I'm tired of talkin', I'm gonna go in and tell you that, I've done all my talkin', my fuckin' pilot is not talkin', you meet my demands or else. You've got 40, 39 minutes left.",,,,,,1,,,timeline,1,1
HT01: Air control.,,,,,,,,,,0,0
PN61: <PN61 First Name> to <HT01 First Name>.,,,,,,,,,,0,0
"HT01: <PN61 First Name>, I want a pack of cigarettes, I'm tired of dealing with this I'm tellin' ya, you all got about 23 minutes left, I want a pack of cigarettes to smoke between now and then, I want um now, I'm willin' to pay for um, send, send um on out this way and nobody's gonna get blown up right now, at least not for another 33 minutes, send me a pack of Marboro's, please.",,,,,,1,,,timeline,1,1
"PN61: Okay, I understand you say you want a pack of Marboro's, correct?",,,,,,,,,,0,0
CH30: That's firm.,,,,,,,,,,0,0
