,PERSUASION TAGS,,,,,,,,Total Persuasive,16,11
,,,,,,,,,,Persasive?,
Posts,OTHER,RECIPROCITY,COMMITMENT,CONSITENCY,LIKING,SCARCITY,AUTHORITY,SOCIAL PROOF,Additional Comments,W/ Other,W/o Other
DAVID: -- cut our lines off so I can't talk to the radio programs. They're telling people that I'm not communicating with them. And the reason being is you all cut all our lines out. ,,,,,,,,,,0,0
"HENRY: Did, did -- was somebody working on that? ",,,,,,,,,,0,0
"DAVID: Well, Jim said so. But you know, we know what's going on. ",,,,,,,,,,0,0
"HENRY: We want this thing to be resolved in such a fashion that everybody comes out of this fine. We don't want anybody else to get hurt. That's number one. Number two, if you have a message, we certainly would like for you to -- ",1,,,,,,,,let's get this resolved because we don't want anyone hurt (REASON),1,0
DAVID: Okay. Wait a second. ,,,,,,,,,,0,0
UNIDENTIFIED FEMALE SPEAKER: Someone's in the tower? What? ,,,,,,,,,,0,0
"DAVID: Someone's in the -- they're, they're coming in. ",,,,,,,,,,0,0
"HENRY: No, they are not coming in. There is nobody anywhere close. ",,,,,,,,,,0,0
"DAVID: Okay, look. Hey, wait a minute. ",,,,,,,,,,0,0
UNIDENTIFIED FEMALE SPEAKER: David was -- ,,,,,,,,,,0,0
UNIDENTIFIED MALE SPEAKER: David -- ,,,,,,,,,,0,0
DAVID: What's he doing on the roof? ,,,,,,,,,,0,0
UNIDENTIFIED FEMALE SPEAKER: What's he doing on the roof -- ,,,,,,,,,,0,0
HENRY: Who's on the roof? ,,,,,,,,,,0,0
DAVID: Wait a minute. It may be one of our guys. ,,,,,,,,,,0,0
HENRY: It's got to be. ,,,,,,,,,,0,0
UNIDENTIFIED MALE SPEAKER: -- looks like he's in -- it's one of the tower sentinels. ,,,,,,,,,,0,0
DAVID: Okay. ,,,,,,,,,,0,0
"UNIDENTIFIED MALE SPEAKER: Oh, shit. ",,,,,,,,,,0,0
"HENRY: It's, it's got to be one of yours. Because our people are not moving in. Nobody is. The only, the only reason we're going to move in is -- ",1,,,,,,,,we're not moving in on you because the only reason we move at all is to get the kids,1,0
DAVID: Wait a minute. ,,,,,,,,,,0,0
HENRY: -- is to pick up the kids. ,1,,,,,,,,we're not moving in on you because the only reason we move at all is to get the kids,1,0
DAVID: (Unidentified voice in background not discernible.) What? (Unidentified voice in background not discernible.) ,,,,,,,,,,0,0
UNIDENTIFIED FEMALE SPEAKER: Tell him -- ,,,,,,,,,,0,0
UNIDENTIFIED MALE SPEAKER: They were just going to shoot -,,,,,,,,,,0,0
"DAVID: Okay. I'm sorry. What's your name,  Harry? ",,,,,,,,,,0,0
HENRY: Henry. ,,,,,,,,,,0,0
"DAVID: Henry, I'm sorry. ",,,,,,,,,,0,0
"HENRY: That's okay, David. ",,,,,,,,,,0,0
"DAVID: Okay. Now I asked, I asked Jim, I said Jim, listen. If they'll let me present -- I mean, you know, this is our lives. You know, this depends on how much you respect our lives. You know, if a man had a -- let's say I was before a firing squad. You would give me at least one last cigarette, wouldn't you? ",,,,,,,,,,0,0
HENRY: Absolutely. ,,,,,,,,,,0,0
"DAVID: Okay. If you would just allow me to show one or two seals on radio, you know, get people -- I mean, I know it's asking a lot from this system today. You know everything costs money, air time and all that. I'm, I'm aware of that. ",,,,,,,,,,0,0
HENRY: Um-hum. ,,,,,,,,,,0,0
"DAVID: And I've spent thousands of dollars, you know. I've been traveling and trying to get the message out. ",,,,,,,,,,0,0
HENRY: Um-hum. ,,,,,,,,,,0,0
"DAVID: If you'd just let me present, you know, the seals the way I see them. ",,,,,,,,,,0,0
HENRY: Uh-huh. ,,,,,,,,,,0,0
"DAVID: You know, then people would be able to judge for themselves. ",,,,,,,,,,0,0
HENRY: I'll tell you what -- ,,,,,,,,,,0,0
"DAVID: And then based upon that, we can arrange something to where we all come out. ",,,1,,,,,,let me show the seals and we will all come out,1,1
"HENRY: Okay. I will work on exactly that. And you telling me, David, I'm trusting you. And I'm putting myself totally in your hands that if I can arrange to have you do that that everybody will come out. ",,,1,,,,,,if I can do that you agree to come out,1,1
"DAVID: What I'm saying is is this. I'm saying that once I'm able to present this if you individuals, if you don't cut me off and don't, you know, don't do like what's been happening so far, right, where everyone cuts me off. You know, hitting me from the side with the questions that do not regard  the points I'm trying to make then we'll come out. ",,,1,,,,,,as long as you don’t cut me off,1,1
HENRY: You're telling me -- ,,,,,,,,,,0,0
DAVID: I'm telling you -- ,,,,,,,,,,0,0
HENRY: You are telling me and you're -- and I'm holding you to your word that -- ,,,,1,,,,,you pledged your word,1,1
DAVID: Is that -- ,,,,,,,,,,0,0
"HENRY: -- if I can make arrangements to have you talk to the radio and what I will do is I will work on, on have you talking to, to a radio -- I'll tell you what. We will -- what I'll do is I'll try to work on getting you something totally and completely different from anything that you've had before in such a fashion that, that we can present this, and it will go out to a lot of radio stations. How's that? Would you be willing to make a tape? ",,,,1,,,,,,1,1
"DAVID: A tape? It's better if I give it live. I mean, you know, I don't need to make a tape. Because, you know, like I say I'd like to hear it. ",,,,,,,,,,0,0
HENRY: Okay. ,,,,,,,,,,0,0
"DAVID: Make sure it's going, you know, nationwide or whatever. ",,,,,,,,,,0,0
HENRY: Okay. Could you come out and do that outside?,,,,,,,,,,0,0
DAVID: I can't move. ,,,,,,,,,,0,0
HENRY: We'll -,,,,,,,,,,0,0
DAVID: I can do it on the phone --- ,,,,,,,,,,0,0
HENRY: we'll carry you out. ,,,,,,,,,,0,0
DAVID: No. ,,,,,,,,,,0,0
"HENRY: I'm saying if, if you want to do it. ",,,,,,,,,,0,0
"DAVID: No, see, there again we can't do that. ",,,,,,,,,,0,0
"HENRY: I'm, I'm -- I was just asking -- ",,,,,,,,,,0,0
"DAVID: On, on --- ",,,,,,,,,,0,0
"HENRY: if you wanted to do it that way. If you don't, okay. ",,,,,,,,,,0,0
DAVID: On the telephone. ,,,,,,,,,,0,0
HENRY: On a telephone? ,,,,,,,,,,0,0
DAVID: On the telephone. ,,,,,,,,,,0,0
HENRY: Okay. ,,,,,,,,,,0,0
DAVID: And you know -- ,,,,,,,,,,0,0
HENRY: Let me work on that. ,,,,,,,,,,0,0
"DAVID: Okay, then get back with me. Okay? ",,,,,,,,,,0,0
HENRY: Okay. ,,,,,,,,,,0,0
DAVID: Because I (indiscernible) I'm losing by --,,,,,,,,,,0,0
HENRY: Okay. Let me just ask you something. We were working on getting some more kids out. Are you ready to send a couple more kids out? ,,,,,,,,,,0,0
"DAVID: Well, let's, let's work on this now. And because this avenue like I told Jim, I said Jim, you know, because he's supposed to be still working with me. I -- what did he do now? ",,,,,,,,,,0,0
"HENRY: Well, he's, you know, he's been forever. We're going to have to give him a little bit of a break. You understand that? ",1,,,,,,,,Jim needs a break so you need to deal with me (REASON),1,0
DAVID: Yeah. ,,,,,,,,,,0,0
"HENRY: Okay. And I'll -- and I promise to work with you in the same fashion that he has. Now let me, let me just propose a couple of things to you. You consider them, okay? ",,,,,,,,,,0,0
DAVID: Okay. ,,,,,,,,,,0,0
"HENRY: One of the things that I want to propose is if we make a tape recording, one of the things that we ensure is that nobody is going to interrupt you with crazy questions or comments or anything like that. ",1,,,,,,,,tape is better than live broadcast (REASON),1,0
"DAVID: Okay. What we'll do then is we'll, we'll -- maybe we can make a tape and a video. And then maybe you can play that. ",,,,,,,,,,0,0
"HENRY: Now do you have, do you have a video? ",,,,,,,,,,0,0
"DAVID: Yes, we have high eight. ",,,,,,,,,,0,0
"HENRY: Okay. Well, why don't you start working on that, and I will start working on it from this end. ",,,,,,,,,,0,0
"DAVID: Okay. All right, then we'll do something.",,,,,,,,,,0,0
HENRY: Okay. Now I'm going to a little -- ,,,,,,,,,,0,0
DAVID: That way at least you'll know where I'm coming from. ,,,,,,,,,,0,0
"HENRY: I'm going to need a little bit of time so that I can, so that I can work on this. In the meantime, can we get -- ",,,1,,,,,,while I am workin on this can I get some kids out?,1,1
DAVID: Okay. ,,,,,,,,,,0,0
HENRY: -- some more children out or do you --,,,1,,,,,,while I am workin on this can I get some kids out?,1,1
"DAVID: Let's just hold off until we get this spot figured out, all right? ",,,,,,,,,,0,0
HENRY: Okay. ,,,,,,,,,,0,0
"DAVID: I need, I need some -- see, I gave, I gave Jim some money, right? ",,,,,,,,,,0,0
HENRY: Yes. We have the money here. ,,,,,,,,,,0,0
"DAVID: And he was going to pick me up a phone, because our phone's really pretty bad. A lot of people use them and we needed, we needed a better line. Okay? Because you know we're -- I mean well, I can't move, so we're long extension. ",,,,,,,,,,0,0
HENRY: Okay. ,,,,,,,,,,0,0
"DAVID: And so if we can get a new line and a phone from, you know, like I said I was going to pay for it. ",,,,,,,,,,0,0
HENRY: Okay. ,,,,,,,,,,0,0
DAVID: Then we'd have better reception. ,,,,,,,,,,0,0
"HENRY: Okay. But do this for me, because I need to have these people, these bosses, you know, they're always real pushy. You understand that? ",,,,,,,1,,I need the kids cause my bosses are pushing me,1,1
DAVID: I realize -- ,,,,,,,,,,0,0
HENRY: Okay. ,,,,,,,,,,0,0
DAVID: -- you got a lot of chiefs there. ,,,,,,,,,,0,0
"HENRY: Right. Send me two more kids while we're working on this so that they can, you know -- ",,,1,,,,,,send us kids out and we'll work on the agreement,1,1
DAVID: I'll do that. ,,,,,,,,,,0,0
HENRY: Okay. Okay. ,,,,,,,,,,0,0
DAVID: Okay? ,,,,,,,,,,0,0
HENRY: So what I'll do is whenever you -- ,,,,,,,,,,0,0
DAVID: I'm glad you have a concern for the children like I do because I have -- ,,,,,,,,,,0,0
"HENRY: Yes. Okay. What we will do is I will start working on this, okay. And it's either going to be a video and the audio, or at least we're going to get radio. But I'll get you something. Or I'll go to work on getting you something. Okay? ",,,,,,,,,,0,0
"DAVID: Yeah. Let's, let's -- like I say you'll, then you'll know, understand where I'm coming from. ",,,,,,,,,,0,0
"HENRY: Okay. But I want you to understand, okay, I'm going to hold you this. You're telling me that --",,,,1,,,,,remember our deal,1,1
DAVID: I --,,,,,,,,,,0,0
HENRY: -- that you're going to send everybody out. I'm going to want everybody out. ,,,,1,,,,,remember our deal,1,1
DAVID: Okay. ,,,,,,,,,,0,0
HENRY: Okay. ,,,,,,,,,,0,0
DAVID: Do what you can though. ,,,,,,,,,,0,0
HENRY: Okay. But send me a couple of kids. I'm going to send a car to pick up the two kids. ,,,,,,,,,,0,0
DAVID: You got the van there now? ,,,,,,,,,,0,0
"HENRY: I'll send it, I'll send the van out. Can we get the van over there? ",,,,,,,,,,0,0
"DAVID: Yeah, well, give me a call or -- ",,,,,,,,,,0,0
HENRY: Okay. The van is going there right now.,,,,,,,,,,0,0
DAVID: Okay. ,,,,,,,,,,0,0
"HENRY: And in the meantime, I'll work on this and I'll call you back in a little bit. ",,,,,,,,,,0,0
DAVID: Okay. Thanks. ,,,,,,,,,,0,0
"HENRY: Thank you, David. ",,,,,,,,,,0,0
DAVID: Bye. ,,,,,,,,,,0,0
HENRY: Bye-bye. ,,,,,,,,,,0,0

DONE