Taylor5_LP,4,0,Hostage_Taker,SO TELL <NAME> THAT HE BETTER FIND HIMSELF A NEW SUPER ALL RIGHT
Taylor5_LP,1628,0,Person,OKAY WELL SHES STILL CARRYING ON SHES PRETTY UPSET <NAME> SHE REALLY WAS YOU KNOW SHES GOT THE HEAVES AND EVERYTHING ELSE
Taylor5_LP,1629,0,Hostage_Taker,SHE HASNT EATEN NOTHING IN FIVE SIX DAY LIKE ME <NAME> I HAVENT HAD A THING IN MY STOMACH FOR SIX DAYS IF THEY DO AN AUTOPSY ON ME THEYRE GONNA FIND NOTHING
Taylor5_LP,1630,0,Person,THEYRE NOT GONNA DO <NAME> DONT TALK THAT WAY
Taylor5_LP,1631,0,Hostage_Taker,IM JUST SAYING THIS IS WHAT THIS KID SHES PUT <NAME> FAINT THE OTHER DAY HER HANDS WERE PARALYZED
Taylor5_LP,1632,0,Person,HER WHAT
Taylor5_LP,1633,0,Hostage_Taker,HER HANDS WERE PARALYZED FOR TWO HOURS WE CALLED <NAME> SHE WOULDNT SHOW UP SEE THESE ARE ALL THE THINGS THAT GO THROUGH MY HEAD YOUR MOTHER YOU LEAVE ON THE FLOOR PARALYZED BECAUSE I WANTED HER HERE TO TAKE HER TO THE HOSPITAL
Taylor5_LP,1634,0,Person,WHO <NAME>
Taylor5_LP,1635,0,Hostage_Taker,YEAH SHE JUST PASSED OUT BANGED HER HEAD AND WENT OUT COMPLETELY AND WHEN SHE CAME WHEN I FINALLY GOT HER TO HER HANDS WERE PARALYZED FOR ABOUT TWO HOURS SHE COULDNT OPEN OR CLOSE THEM THEY WERE OPEN BUT SHE COULDNT CLOSE THEM COULDNT MOVE THEM
Taylor5_LP,1636,0,Person,BUT DIDNT SHE HAVE THAT PROBLEM WHERE STITCHES OR SOMETHING A FEW MONTHS BACK
Taylor5_LP,1637,0,Hostage_Taker,<NAME> SHE HAS <NAME> THATS A BLOOD DISEASE SHE CAN GO INTO STROKES
Taylor5_LP,1638,0,Person,<NAME> NOW WE GOTTA HELP THIS SITUATIONS BETWEEN HER GOING INTO STROKES MY BLOOD PRESSURE AND <NAME> HERE AND YOUR CHEST PAINS THATS RIGHT SEE <NAME> SEE THE KIND OF MAN <NAME> IS HE JUST REMINDED ME OF YOUR CHEST PAINS
Taylor5_LP,1639,0,Hostage_Taker,I DONT CARE ABOUT THEM <NAME> I DONT GIVE A FUCK ABOUT THEM
Taylor5_LP,1640,0,Person,WELL WHAT DO YOU SAY
Taylor5_LP,1641,0,Hostage_Taker,WHERES <NAME>
Taylor5_LP,1642,0,Person,<NAME> SAYS SHES GOT THE HEAVIE JEAVIES HE SAYS WATCH SHE CAN GO INTO STROKES JUST HAVE SOMEBODY STAND BY THE DOOR BY HER IS SHE TREATED FOR THAT <NAME>
Taylor5_LP,1643,0,Hostage_Taker,NO SHE DONT TAKE NOTHING SHE WONT GO SHES LIKE ME
Taylor5_LP,1644,0,Person,STUBBORN
Taylor5_LP,1645,0,Hostage_Taker,YEAH AND I JUST GOT THE BLUE CROSS BLUE SHIELD
Taylor5_LP,1646,0,Person,YOU JUST GOT ALL YOUR HOSPITALIZATIONS
Taylor5_LP,1647,0,Hostage_Taker,YEAH
Taylor5_LP,1648,0,Person,<NAME> TALKING WITH THE PARAMEDICS HE SAYS EVERYBODYS GOTTA GET TREATMENT YOU <NAME> ME IF MY PRESSURE STARTS GOING UP
Taylor5_LP,1649,0,Hostage_Taker,WELL ITS JUST LIKE <PLACE> WHEN THEY TOOK HER THEY TOOK HER UP TO OPERATING THEY PUT ME DOWN IN THE GODDAMN FUCKING EMERGENCY ROOM THE ONE IN <PLACE>
Taylor5_LP,1650,0,Person,WERE YOU HURT THAT TIME
Taylor5_LP,1651,0,Hostage_Taker,YEAH BUT SHE HAD THREE BULLETS IN HER
Taylor5_LP,1652,0,Person,JEEZ
Taylor5_LP,1653,0,Hostage_Taker,I DONT FORGET NOTHING <NAME> THATS WHATS WRONG WITH ME MY MEMORY IS TOO FUCKING GOOD I REMEMBER ALL THESE HATEFUL THINGS I CANT GET THEM OUT OF MY MIND IF I LIVED A NORMAL LIFE AND I WAS TREATED WITH RESPECT AND LOVE MAYBE I WOULD OF YOU KNOW WHEN I DID COME OUT THIS TIME I WOUDLD HAVE TURNED OUT GOOD
Taylor5_LP,1654,0,Person,I THINK YOU DID NOBODYS GONNA CHANGE THAT OPINION OF ME I DONT CARE WHAT HAPPENED HERE TODAY BUT I THINK YOU DID
Taylor5_LP,1655,0,Hostage_Taker,HOW MANY GUYS CAN COME OUT WITH MY RECORD <NAME> AND GET LIKE THIS
Taylor5_LP,1656,0,Person,NONE THAT IVE KNOWN <NAME> OVER MY POLICE CAREER IVE ARRESTED QUITE A NUMBER OF THEM
Taylor5_LP,1657,0,Hostage_Taker,THEY COME OUT THEY FEEL SORRY FOR THEMSELVES THEY GO TO WELFARE THEY BECOME BUMS AND SO ON I STARTED TO MAKE A FAMILY AGAIN
Taylor5_LP,1658,0,Person,WHAT DID YOU SAY I DIDNT HEAR YOU
Taylor5_LP,1659,0,Hostage_Taker,I STARTED TO MAKE A FAMILY AGAIN TAKE CARE OF A FAMILY
Taylor5_LP,1660,4,Person,WELL I THINK <NAME> WE ARE REALLY LOSING GROUND WE ARE WASTING TIME YOU GOTTA MAKE THAT DECISION FOR ME HERE YOU GAVE ME YOUR WORD YOUVE BEEN TRUTHFUL WITH ME
Taylor5_LP,1661,0,Hostage_Taker,PUT <NAME> PUT <NAME> ON
Taylor5_LP,1662,0,Person,WHATS HAPPENING WITH HIS WIFE HE WANTS HER SEE YOURE GETTING CONFUSED NOW SHES BY THE PARAMEDICS OKAY A FEW MINUTES SHE GOT SICK REAL BAD AND THEY TOOK HER OUT BY THE AMBULANCE WITH THE PARAMEDICS THEYVE BEEN GOOD THEYRE A BUNCH OF YOUNG WOMEN AND GUYS OUT THERE
Taylor5_LP,1663,0,Hostage_Taker,I KNOW
Taylor5_LP,1664,0,Person,IM GETTING CONFUSED WITH THE NAMES WITH <NAME>
Taylor5_LP,1665,0,Hostage_Taker,YEAH I GAVE <NAME> EVERYTHING MY WALLETS THE BANK ACCOUNTS EVERYTHING
Taylor5_LP,1666,0,Person,SHE TOLD ME THAT SHE TOLD ME THAT OUTSIDE WHEN I TALKED TO HER
Taylor5_LP,1667,0,Hostage_Taker,ALL I WANT IS A DECENT FUNERAL
Taylor5_LP,1668,0,Person,WE ARE PAST THAT YOURE NOT GONNA HURT YOURSELF YOURE NOT GONNA HURT ANYBODY ELSE WE ARE NOT GONNA WORRY ABOUT YOUR FUNERAL
Taylor5_LP,1669,0,Hostage_Taker,I HAVENT STOPPED SMOKING
Taylor5_LP,1670,0,Person,THATS NO GOOD THATS GONNA TIGHTEN UP YOUR CHEST
Taylor5_LP,1671,0,Hostage_Taker,<NAME> ITS THE ONLY THING THAT SETTLES MY NERVES
Taylor5_LP,1672,0,Person,OH ALL RIGHT IF IT HELPS YOU SHOULD BE COMING OUT THOUGH WHERE THEY CAN REALLY EXAMINE YOU <NAME>
Taylor5_LP,1673,0,Hostage_Taker,LET ME SEE LET ME TALK TO <NAME>
Taylor5_LP,1674,0,Person,ALL RIGHT CAN WE GET <NAME> HE WANTS HER BETTER TO HOLD ON A LITTLE BIT <NAME> SHES STILL LET ME GO LOOK AND CHECK ON HER HOLD ON TALK TO <NAME> LET ME GO CHECK ON <NAME> MYSELF
Taylor5_LP,1675,0,Hostage_Taker,ALL RIGHT
Taylor5_LP,1676,0,Person,<NAME> YEAH I JUST WENT OUT THERE SHE CAME IN TO GO TO THE BATHROOM SHE GOT SICK AND THEY GOT HER LAYING DOWN ON THE STRETCHER OUT THERE
Taylor5_LP,1677,0,Hostage_Taker,I WANNA TALK TO HER
Taylor5_LP,1678,0,Person,WELL YOU CANT TALK TO HER RIGHT NOW SHES ON A STRETCHER OKAY AS SOON AS THEY RELEASE WELL YOU KNOW BRING HER IN ALL RIGHT NOW
Taylor5_LP,1679,0,Hostage_Taker,HOW LONG IS THAT
Taylor5_LP,1680,0,Person,HEY <NAME> IM NOT A DOCTOR WHAT DO I KNOW IM ONLY A DUMB COP THATS TALKING TO YOU ON THE TELEPHONE
Taylor5_LP,1681,0,Hostage_Taker,TO A DUMB FOOL
Taylor5_LP,1682,5,Person,WELL I WOULDNT SAY THAT YET YOU KNOW I MEAN WE ARE NOT YOU KNOW YOU GOTTA GIVE YOUR BUDDY <NAME> A BREAK HERE TOO
Taylor5_LP,1683,0,Hostage_Taker,I WANNA TALK TO MY WIFE <NAME> PLEASE
Taylor5_LP,1684,0,Person,OKAY
Taylor5_LP,1685,0,Hostage_Taker,PLEASE
Taylor5_LP,1686,0,Person,<NAME> LIKE I SAID BEFORE SHES LAYING DOWN IN THE AMBULANCE
Taylor5_LP,1687,0,Hostage_Taker,THEN BRING THE PHONE TO HER
Taylor5_LP,1688,1,Person,I CANT ITS NOT A I DONT HAVE A PORTABLE PHONE RIGHT NOW IM IN A HOUSE SHES ABOUT A HALF A BLOCK DOWN FROM ME
Taylor5_LP,1689,0,Hostage_Taker,ALL RIGHT
Taylor5_LP,1690,0,Person,YOURE STUCK TALKING TO ME THATS IT
Taylor5_LP,1691,0,Hostage_Taker,I WANNA TALK TO HER BEFORE THIS IS OVER BEFORE I EVEN SAY YES IM GIVING UP I WANNA TALK TO HER THATS THE BOTTOM LINE
Taylor5_LP,1692,0,Person,OKAY LET ME ASK YOU THIS <NAME> ALL RIGHT NOW BEAR WITH ME OKAY YOU WANT TO TALK TO YOUR WIFE WHAT ARE YOU GONNA GIVE US WE ARE PLAYING CARDS ALL RIGHT
Taylor5_LP,1693,3,Hostage_Taker,ILL GIVE YOU A DEFINITE ANSWER AFTER I TALK TO MY WIFE
Taylor5_LP,1694,0,Person,NO NO
Taylor5_LP,1695,0,Hostage_Taker,THEN FORGET IT
Taylor5_LP,1696,0,Person,NO ITS GETTING TIME TO PLAY HARDBALL
Taylor5_LP,1697,0,Hostage_Taker,ALL RIGHT
Taylor5_LP,1698,0,Person,YOU GOTTA PROMISE ME SOMETHING
Taylor5_LP,1699,3,Hostage_Taker,AFTER I TALK TO MY WIFE I WANNA SEE WHAT SHE HAS TO SAY AND THEN ILL GIVE YOU MY DECISION
Taylor5_LP,1700,3,Person,NO YOU PROMISE ME SOMETHING AND THEN ILL GO DOWN AND
Taylor5_LP,1701,0,Hostage_Taker,THATS THE PROMISE
Taylor5_LP,1702,3,Person,THEN YOURE GONNA MAKE YOUR DECISION
Taylor5_LP,1703,0,Hostage_Taker,YEAH
Taylor5_LP,1704,3,Person,AS SOON AS YOU TALK TO HER
Taylor5_LP,1705,0,Hostage_Taker,THATS RIGHT
Taylor5_LP,1706,3,Person,OKAY THEN WE HAVE YOUR WORD ON IT
Taylor5_LP,1707,0,Hostage_Taker,YOU HAVE MY WORD
Taylor5_LP,1708,3,Person,OKAY IM NOT GONNA GET A RUNAROUND AFTER IT THATS IT GENTLEMAN TO GENTLEMAN WE GOT YOUR WORD AFTER YOU TALK TO HER YOURE GONNA TELL ME ONE WAY OR THE OTHER WHATS GONNA HAPPEN
Taylor5_LP,1709,0,Hostage_Taker,RIGHT
Taylor5_LP,1710,0,Person,OKAY HANG ON A MINUTE <NAME> YOU GOTTA PROMISE ME SOMETHING BEFORE YOU TALK TO HER THOUGH
Taylor5_LP,1711,0,Hostage_Taker,WHATS THAT
Taylor5_LP,1712,0,Person,DONT GET HER ALL UPSET
Taylor5_LP,1713,0,Hostage_Taker,I WONT
Taylor5_LP,1714,0,Person,OKAY
Taylor5_LP,1715,0,Hostage_Taker,ALL RIGHT
Taylor5_LP,1716,0,Person,BECAUSE SHES GONNA END UP
Taylor5_LP,1717,0,Hostage_Taker,I DONT WANNA HURT HER
Taylor5_LP,1718,1,Person,HERES THE THING ALL RIGHT NOW PAY ATTENTION IF YOU GET HER UPSET AND SHE GETS SICKER AND THEY HAVE TO TAKE HER TO THE HOSPITAL THEN YOURE NOT GONNA BE ABLE TO SEE HER WHEN YOU COME OUT
Taylor5_LP,1719,0,Hostage_Taker,ALL RIGHT
Taylor5_LP,1720,3,Person,ALL RIGHT SHES GONNA BE IN THE HOSPITAL ALL RIGHT IM GONNA LET YOU TALK TO <NAME> ILL GO GET YOUR WIFE AND THEN YOURE GONNA PROMISE <NAME> IM GONNA PUT <NAME> ON THE PHONE YOURE GONNA MAKE THE SAME PROMISE TO HIM THAT YOU MADE TO ME OKAY AND THEN WELL SEE WHAT HAPPENS
Taylor5_LP,1721,0,Hostage_Taker,ALL RIGHT
Taylor5_LP,1722,3,Person,<NAME> HE WANTS TO TALK TO YOU AND HES GONNA PROMISE YOU THE SAME THING HE PROMISED ME THAT AFTER HE TALKS TO HIS WIFE HES GONNA MAKE HIS DECISION AND TELL US HELL KEEP HIS PROMISE SOMEBODY GONNA HELP HER UP BECAUSE SHE CANT SOMEBODY GOTTA HELP HER ITS TAKING A TOLL ON <NAME> NOW SHES WORRIED ABOUT THAT LITTLE GIRL THAT YOU HAVE THERE VISITING THE OTHER LITTLE GIRL THAT WAS THERE
Taylor5_LP,1723,0,Hostage_Taker,YEAH
Taylor5_LP,1724,0,Person,SOME WAY THEY GOT SEPARATED
Taylor5_LP,1725,0,Hostage_Taker,THEY GOT SEPARATED WHAT DO YOU MEAN
Taylor5_LP,1726,0,Person,WELL THEY GOT SEPARATED YOU KNOW THERE WAS ANOTHER LITTLE GIRL THERE A FRIEND OF <NAME>
Taylor5_LP,1727,0,Hostage_Taker,SEE <NAME> I COULD HAVE KEPT HER IN THIS HOUSE TOO
Taylor5_LP,1728,5,Person,WELL SOME WAY THEY GOT SEPARATED <NAME> IS JUST STARTING TO REALIZE COMING OUT OF IT BUT ITS TAKEN A TOLL ON HER BAD <NAME> BELIEVE ME AGAIN THIS IS NOT <NAME> THIS WOMANS GOT FEELINGS FOR YOU <NAME> FOR YOU
Taylor5_LP,1729,0,Hostage_Taker,YEAH
Taylor5_LP,1730,5,Person,AND HER CONCERN IS FOR YOU
Taylor5_LP,1731,0,Hostage_Taker,MY FEELINGS ARE FOR HER TOO <NAME> ONE HUNDRED PERCENT I LOVE THAT WOMAN BUT SHE KEPT GOING AND KEPT GOING BELIEVING IN HER KIDS MORE THAN SHE DID ME
Taylor5_LP,1732,0,Person,WELL IM GONNA DEBATE WITH YOU ON THAT ONE <NAME> BECAUSE LIKE SHE TOLD ME OUTSIDE SHE SAID <NAME> I HAVE FIVE KIDS IM DOWN TO TWO BECAUSE MY LIFE IS <NAME> IM STILL STICKING BY <NAME> ITS TAKEN A TOLL ON HER THATS NOT A TOUGH COLD <NAME> I REMEMBER THAT DAY IM TELLING THESE GUYS HOW SHE COME OUT SHE WAS JUST AS TOUGH AS WHEN WE WENT IN NOT HER THIS WOMAN IS OUT ON A STRETCHER HYPERVENTILATING I DINT KNOW SHE WAS THAT SICK OF A GIRL EITHER
Taylor5_LP,1733,0,Hostage_Taker,YEAH AND THESE KIDS HAVE DRIVEN HER TO IT THEYVE TAKEN THERE TOLL WITH HER AND ME AND THEY JUST WALK FREE TO GO PLAY
Taylor5_LP,1734,0,Person,THE OTHER LITTLE GIRL THEY LOCATE HER THE OTHER LITTLE GIRL <NAME>
Taylor5_LP,1735,0,Hostage_Taker,YEAH SHE BROUGHT HER OVER HERE
Taylor5_LP,1736,0,Person,ALL RIGHT LIKE I SAID SOMEBODY ALL OF A SUDDEN REMEMBERED THERE WAS A <NAME> AND I REMEMBER EARLIER YOU TELLING ME YOU LET HER GO OUT AND NOW THEY JUST LOCATED HER APPARENTLY SHES NOT FROM THIS AREA
Taylor5_LP,1737,0,Hostage_Taker,NO SHES FROM <PLACE> <NAME> BROUGHT HER HERE WITH THAT PICKUP TRUCK
Taylor5_LP,1738,0,Person,WELL ANYWAY THEY LOCATED HER SOMEWAY THEY GOT SEPARATED AND I GUESS IT HIT <NAME> AND A LOT OF THINGS ARE STARTING TO HIT <NAME> YOU KNOW
Taylor5_LP,1739,0,Hostage_Taker,<NAME> STILL THERE
Taylor5_LP,1740,5,Person,YES HES OUTSIDE HES ALL BROKEN UP <NAME> YOU TELL ME ABOUT ONE PERSON THAT DOSENT LOVE YOU BUT YOU GOT THESE OTHER THE KID CANT EVEN TALK TO YOU HES SO SHOOK UP ABOUT IT <NAME>
Taylor5_LP,1741,0,Hostage_Taker,<NAME> HE KNOWS THAT HIS FATHER WENT AND IM THE ONLY ONE HE HAD LEFT
Taylor5_LP,1742,1,Person,THERES A KID THAT REPLACED A SON FOR YOU REMEMBER THAT THE KIDS SINCERE I MEAN HES SHOOKEN UP ABOUT IT THEY ALL ARE
Taylor5_LP,1743,0,Hostage_Taker,HES A GOOD KID HES A REAL GOOD KID IM REAL PROUD OF HIM AND HIS FATHER WOULD BE IF HE WAS HERE
Taylor5_LP,1744,1,Person,THERE YOU GO SO YOU LOSE ONE ON ONE HAND <NAME> AND YOU GAIN ANOTHER AND SOMETIMES ITS THE ONES YOU GAIN THAT HAVE A STRONGER BOND
Taylor5_LP,1745,0,Hostage_Taker,<NAME> IVE LOST ALL MY LIFE LOOK HOW MANY FUCKING KIDS I BROUGHT INTO THIS WORLD AND NOT ONE OF THEM GIVES A FUCK ABOUT ME
Taylor5_LP,1746,1,Person,YEAH BUT YOU HAVE A NEPHEW THAT PROBABLY IS EQUALLY
Taylor5_LP,1747,0,Hostage_Taker,IM TALKING ABOUT KIDS <NAME> FLESH AND BLOOD
Taylor5_LP,1748,5,Person,I KNOW WHAT YOURE SAYING I KNOW WHAT YOURE SAYING ITS ROUGH BUT YOU GOT SOME FAMILY THATS WHAT IM TRYING TO SAY THAT DO LOVE YOU LIKE THIS KID <NAME> YOU KNOW HERES A KID YOU STRAIGHTENED OUT YOU KNOW I GIVE YOU A LOT OF CREDIT FOR THAT BECAUSE THAT KID WAS ON THE FENCE AT ONE TIME WASNT HE
Taylor5_LP,1749,0,Hostage_Taker,I KNOW I KNOW
Taylor5_LP,1750,5,Person,HE CAME BY YOU HE LOOKED UP TO YOU HE IDOLIZED YOU HIS FATHER PASSED AWAY
Taylor5_LP,1751,0,Hostage_Taker,HE SAID HIS FATHER SAID YOURE GONNA BE A BUM AND HE SAID TO HIMSELF NO IM NOT
Taylor5_LP,1752,5,Person,NO WAY OKAY AND HE HAD HIS UNCLE <NAME> TO LOOK UP TO AND HE RESPECTED YOU IM SURE HE SEEN WHAT YOU WENT THROUGH THIS IS A GOOD EXAMPLE OF WHAT YOUVE CREATED SOMEBODY THAT S GOOD SOMEBODY THAT CARES ABOUT YOU YOU CANT LET THAT BOY DOWN EITHER
Taylor5_LP,1753,0,Hostage_Taker,HES GOT EIGHTEEN HUNDRED NINETY THOUSAND DOLLAR HOME OUT HERE HES GOT A PERFECT JOB HES NOT A BUM HE DONT FUCK AROUND HES NOT ON DRUGS WISH MY BROTHER WAS HERE AND THATS WHAT HE SAID I WISH MY FATHER WAS HERE TO EAT THE WORDS HE SAID
Taylor5_LP,1754,1,Person,<NAME> AND YOU CAN TAKE THAT CREDIT BECAUSE WHEN YOUR BROTHER PASSED AWAY YOU STEPPED INTO YOU BROTHERS SHOES FOR <NAME> AND THAT KID KNOWS IT IM TELLING YOU HES OUT THERE BAWLING LIKE A BABY <NAME> WHEN HE WAS TALKING TO YOU HE WAS ALL EMOTION AND CHOKE UP YOU KNOW THE SCENE HERE IS CHANGED <NAME> WE ARE NOT A BUNCH OF HARD COPS SAYING GO GET THAT GUY WE ALL FEEL WE ALL GET LUMPS IN OUR THROATS WE KNOW WHATS GOING ON OUT THERE SO THE MEN THAT ARE HERE ON THIS NEGOTIATING THEYRE WARM THEY FEEL CLOSE TO YOU THEYRE FEELING WHAT YOURE FEELING
Taylor5_LP,1755,0,Hostage_Taker,<NAME> NOBODY KNOWS BETTER THAN YOU THAT WHAT IVE GONE THROUGH YOUVE BEEN THERE TWICE NOW AND NOBODY KNOWS THE FUCKING PUNISHMENT AND THE PAIN IVE HAD TO ENDURE IN JAIL OUT OF JAIL AND ITS NOT LIVING ITS NOT THE LIFE YOU HAVE THAT YOU GO HOME TO A HAPPY HOME AND LOVE AND SO ON AND SO FORTH YOU DONT HAVE TREACHEROUS KIDS IVE HAD NOTHING BUT TREACHEROUS KIDS
Taylor5_LP,1756,0,Person,<NAME> HERES <NAME> OKAY TAKE IT A LITTLE EASY ON HER BECAUSE SHES REALLY WOBBLY HOLD ON
Taylor5_LP,1757,0,Other,HI HONEY
Taylor5_LP,1758,0,Hostage_Taker,HI
Taylor5_LP,1759,0,Other,HOW YOU HOLDING OUT
Taylor5_LP,1760,0,Hostage_Taker,HOW DO YOU FEEL
Taylor5_LP,1761,5,Other,VERY BAD IM WORRIED ABOUT EVERYBODY IM WORRIED ABOUT YOU I LOVE YOU AND YOU KNOW I ALWAYS WILL <NAME> ILL STICK BY YOU BELIEVE ME IM NOT <NAME> <NAME> IVE PROVED MY LOVE TO YOU A THOUSAND TIMES I WILL STICK BY YOU I DONT CARE WHAT HAPPENS TO YOU ILL BE THERE
Taylor5_LP,1762,0,Hostage_Taker,<NAME> PLEASE LET ME GO OUT WITH A CLEAN SLATE PLEASE
Taylor5_LP,1763,0,Other,PLEASE <NAME>
Taylor5_LP,1764,0,Hostage_Taker,YOU HEAR WHAT I SAID
Taylor5_LP,1765,0,Other,DONT TALK LIKE THAT
Taylor5_LP,1766,0,Hostage_Taker,IM JUST ASKING YOU PLEASE
Taylor5_LP,1767,0,Other,NO YOU CANT DO THIS <NAME>
Taylor5_LP,1768,0,Hostage_Taker,IM NOT SAYING IM DOING ANYTHING <NAME> JUST GIVE ME A CLEAN SLATE GO TAKE YOUR LIFE FROM THERE BECAUSE IM GONNA ROT IF I GIVE UP IM GONNA ROT IN JAIL
Taylor5_LP,1769,5,Other,NO YOURE NOT GONNA ROT BECAUSE IM GONNA BE BESIDE YOU <NAME> EVERY INCH OF THE WAY <NAME> <NAME> LISTEN TO ME PLEASE I LOVE YOU AND YOU DONT TURN IT ON AND OFF LIFE A LIGHT BULB I CARE ABOUT WHAT HAPPENS TO YOU
Taylor5_LP,1770,0,Hostage_Taker,<NAME> YOU DONT KNOW HOW MANY TIMES I WISHED YOU WOULDVE SAID FUCK THEM KIDS
Taylor5_LP,1771,0,Other,I WISH I WOULDVE NOW <NAME> BELIEVE ME
Taylor5_LP,1772,0,Hostage_Taker,THAT WOULD HAVE STOPPED EVERYTHING YEARS AGO IF YOU WOULD HAVE SAID TO ME I LOVE YOU FUCK THEM KIDS I DONT CARE WHAT THEY DO
Taylor5_LP,1773,1,Other,I DIDNT REALIZE IT <NAME> I DIDNT REALIZE IT WAS THIS BAD IM GONNA STICK BY YOU IN YEARS TO COME BY YOURE GONNA SAY SHE MEANT IT SHE STUCK BY ME I AM GOING TO STICK BY YOU EVERY INCH OF THE WAY <NAME> EVERY INCH I WILL BE ANYWHERES YOURE GONNA BE I WILL BE THERE FOR YOU ANYTIME YOU NEED ME I WILL BE THERE THIS ISNT <NAME> TALKING <NAME> THIS IS <NAME> AND I HAVE STUCK BY YOU MY MARRIAGE VOWS SAID FOR BETTER OR FOR WORSE
Taylor5_LP,1774,0,Hostage_Taker,WHERES <NAME>
Taylor5_LP,1775,0,Other,<NAME> OVER <NAME> HOUSE SHES FINE SHE DOESNT KNOW NOTHING
Taylor5_LP,1776,0,Hostage_Taker,<NAME> KNOW WHATS GOING ON
Taylor5_LP,1777,0,Other,YES ITS ALL OVER
Taylor5_LP,1778,0,Hostage_Taker,ITS ALL OVER
Taylor5_LP,1779,0,Other,YEAH BUT <NAME> ITS GONNA BE FINE ITS GONNA BE FINE BECAUSE IM GONNA STICK BY YOU GET THAT THROUGH YOUR HEAD IM GONNA BE THERE
Taylor5_LP,1780,0,Hostage_Taker,NO WHAT I WANT YOU TO DO WHEN YOU HANG WHEN I DONT TALK TO YOU NO MORE I WANT TO SAY IN YOUR HEAD I LOVE YOU HE LOVED ME HE LOVED ME WITH ALL HIS HEART AND SOUL
Taylor5_LP,1781,0,Other,DONT TALK LIKE THAT <NAME> DONT DO ANYTHING STUPID PLEASE
Taylor5_LP,1782,0,Hostage_Taker,NO DO YOU HERE WHAT I SAID <NAME>
Taylor5_LP,1783,0,Other,I HEAR YOU <NAME> I KNOW YOU LOVE ME
Taylor5_LP,1784,0,Hostage_Taker,WHEN IM LAID OUT
Taylor5_LP,1785,4,Other,NO <NAME> IF YOU LOVE ME AS MUCH AS YOU SAY YOU DO YOU WONT DO WHAT YOURE GONNA DO YOULL THINK AGAIN PLEASE PLEASE <NAME> FOR GODS SAKES THINK ABOUT THINGS LIFE CANT BE THAT BAD <NAME> WE CAN MAKE IT WE CAN EVEN NO MATTER WHERE YOU ARE WE CAN MAKE IT I LOVE YOU BABE
Taylor5_LP,1786,0,Person,<NAME> <NAME>
Taylor5_LP,1787,0,Hostage_Taker,<NAME>
Taylor5_LP,1788,0,Person,<NAME> <NAME> YOU THERE
Taylor5_LP,1789,0,Hostage_Taker,<NAME>
Taylor5_LP,1790,0,Person,YEAH OKAY WAIT A MINUTE
Taylor5_LP,1791,0,Hostage_Taker,WHAT HAPPENED TO HER
Taylor5_LP,1792,0,Person,SHES RIGHT HERE SHES JUST GETTING TOO EXCITED SHES GETTING A LITTLE UPSET WE GOTTA TAKE IT EASY WITH HER
Taylor5_LP,1793,0,Hostage_Taker,NO IM TRYING TO TAKE IT EASY WITH HER THE PHONE FELL DOWN AND I COULDNT GET A HOLD OF IT TO GET BACK TO HER
Taylor5_LP,1794,0,Person,OKAY OKAY ALL RIGHT HANG ON A MINUTE HANG ON SHES SITTING HERE WRINGING HER HANDS JUST CALM DOWN AND ILL LET YOU TALK TO HER OKAY
Taylor5_LP,1795,0,Hostage_Taker,YEAH
Taylor5_LP,1796,0,Other,OKAY <NAME> IM BACK <NAME>
Taylor5_LP,1797,0,Hostage_Taker,<NAME> I DONT WANT IT THIS WAY
Taylor5_LP,1798,3,Other,I DONT WANT IT EITHER THIS WAY <NAME> ILL DO ANYTHING YOU ASK <NAME> ANYTHING JUST PLEASE PLEASE PLEASE TRY TO COOPERATE <NAME> I SWEAR BY YOU SWEAR IF ANYTHING IS HOLY I SWEAR I NEVER TALKED TO GOD IN MY LIFE BUT IM TALKING TO HIM NOW LET YOU AND <NAME> COME OUT OKAY
Taylor5_LP,1799,0,Hostage_Taker,<NAME> SWORE THAT I DROPPED DEAD THAT SHE WOULD CHANGE DID SHE KEEP IT
Taylor5_LP,1800,5,Other,I KNOW <NAME> I KNOW ITS A TEENAGE KID TALKING YOU KNOW ALL THE THINGS THAT SHES DONE BUT ALL DEEP DOWN INSIDE HER <NAME> SHE LOVE YOU IS SHE OKAY
Taylor5_LP,1801,0,Hostage_Taker,SHES ALL RIGHT
Taylor5_LP,1802,0,Other,IS SHE WAKING UP
Taylor5_LP,1803,0,Hostage_Taker,SHES STILL CONSCIOUS
Taylor5_LP,1804,0,Other,OKAY
Taylor5_LP,1805,0,Hostage_Taker,TELL <NAME> GIVE ME A COUPLE OF MINUTES AND LET ME MAKE A
Taylor5_LP,1806,5,Other,<NAME> JUST REMEMBER WHEN YOU HANG UP THE PHONE PLEASE I LOVE YOU
Taylor5_LP,1807,0,Hostage_Taker,I LOVE YOU TOO <NAME>
Taylor5_LP,1808,5,Other,I LOVE YOU WITH ALL MY HEART AND
Taylor5_LP,1809,0,Hostage_Taker,TELL <NAME> THAT TOO
Taylor5_LP,1810,1,Other,REMEMBER ONE THING <NAME> ILL STICK BY YOU ILL STICK ILL BE THERE WHEN YOU NEED ME ILL BE THERE I CAN WE CAN WORK THINGS OUT <NAME> BELIEVE ME WE CAN
Taylor5_LP,1811,0,Hostage_Taker,OKAY
Taylor5_LP,1812,5,Other,HERES THE DETECTIVE <NAME> ILL TALK TO YOU IN A FEW MINUTES OKAY I LOVE YOU BABE AND THINK THINK BEFORE YOU DO ANYTHING STUPID
Taylor5_LP,1813,0,Hostage_Taker,I WILL
Taylor5_LP,1814,0,Person,<NAME>
Taylor5_LP,1815,0,Hostage_Taker,YEAH
Taylor5_LP,1816,0,Person,OKAY YOU SPOKE TO HER OKAY ALL RIGHT NOW HOW ARE WE GONNA WORK THIS OUT
Taylor5_LP,1817,0,Hostage_Taker,I HATE TO KEEP ASKING YOU GIVE ME A COUPLE OF MINUTES PLEASE A BABY THAT HAS NOTHING BUT VENOM IN HER MIND LIKE A SNAKE
Taylor5_LP,1818,0,Person,MAYBE MAYBE THIS IS CURED HER MAYBE THATS TURNED HER AROUND MAYBE <NAME> EVERYTHING YOU GAVE
Taylor5_LP,1819,0,Hostage_Taker,AT MY EXPENSE SHE TORE MY HEART APART CAME HERE TODAY KNOWING I WAS IN FUCKNIG PAIN AND WHAT DID SHE DO WALK AWAY DO I GOTTA BE DEAD
Taylor5_LP,1820,8,Person,LET ME SAY SOMETHING SOMETIMES A KID DOESNT REALLY KNOW HOW TO HANDLE WHAT THEY THINK THE PARENTS AND DOING WITH THEM YOU GOTTA KNOW THAT <NAME> YOUVE GONE THROUGH ENOUGH KIDS AS FAR AS SADNESS OR WHATEVER MAYBE YOU WERE A LITTLE BIT TOO HARD ON HER MAYBE YOU WERE A LITTLE BUT TOO HARD ON HER MAYBE AGAIN MAYBE YOURE PICKING ON HER LIKE THE <NAME> AND EVERY THING ELSE THE TIMES IVE SEEN YOU TWO HAPPY I WOULD NEVER BELIEVE IT THE TIMES WITH THE CARS AND THE STICKERS
Taylor5_LP,1821,0,Hostage_Taker,<NAME> TWENTY YEARS AGO DID I PREDICT WHAT <NAME> WAS GONNA WIND UP
Taylor5_LP,1822,0,Person,YEAH YOU DID
Taylor5_LP,1823,0,Hostage_Taker,DIDNT I
Taylor5_LP,1824,0,Person,YEAH YOU DID BUT IM GONNA TELL YOU SOMETHING
Taylor5_LP,1825,0,Hostage_Taker,I WAS NOT GONNA MAKE A REPEAT OF THIS ONE HERE
Taylor5_LP,1826,0,Person,BUT YOU DIDNT PREDICT THAT WITH THIS ONE <NAME>
Taylor5_LP,1827,0,Hostage_Taker,YEAH BUT THE DIFFERENCE IS I PROTECTED THIS ONE HERE AND IT WAS FOR NOTHING
Taylor5_LP,1828,1,Person,SHE STILL NEEDS YOUR PROTECTION <NAME> SHE NEEDS YOUR PROTECTION TO LIVE AND BECOME A YOUNG LADY AND HER FUTURES IN YOUR HANDS JUST LIKE <NAME> IM JUST AS CONCERNED FOR HER SISTER YOU DO WANT <NAME> GROWING UP
Taylor5_LP,1829,0,Hostage_Taker,AGAIN ILL TELL YOU <NAME> LET ME THINK ABOUT IT
Taylor5_LP,1830,0,Person,OKAY YOU THINK ABOUT IT BUT STAY ON THE PHONE WITH ME HOWS YOUR CHEST
Taylor5_LP,1831,0,Hostage_Taker,WHERES <NAME>
Taylor5_LP,1832,0,Person,<NAME> I HAVE NO IDEA
Taylor5_LP,1833,0,Hostage_Taker,<NAME> I GOT PAINS THATS UNBELIEVABLE ITS LIKE A FUCKING KNIFE IS GOING OT OR HAS
Taylor5_LP,1834,3,Person,POP ANOTHER PILL BRING <NAME> AND YOURSELF <NAME> BRING <NAME> AND YOURSELF OUT LET THE DOCTORS OR THE PARAMEDICS ILL EVEN GO TO THE HOSPITAL WITH YOU IF THEYLL ALLOW ME
Taylor5_LP,1835,0,Hostage_Taker,NO
Taylor5_LP,1836,0,Person,I THINK THIS GUY <NAME> COULD PULL LITTLE STRINGS TO LET ME GO
Taylor5_LP,1837,0,Hostage_Taker,WHERES <NAME>
Taylor5_LP,1838,0,Person,I DONT KNOW YOU KEEP SAYING <NAME> AND <NAME> HOW CAN <NAME> HAVE GOTTEN HERE
Taylor5_LP,1839,0,Hostage_Taker,ANYONE OF THEM PUT THEM TRY TO GET THEM ON BEFORE
Taylor5_LP,1840,0,Person,CAN ONE OF YOU FELLOWS FIND <NAME> THATS HIS NEPHEW
Taylor5_LP,1841,0,Hostage_Taker,THATS MY SON
Taylor5_LP,1842,0,Person,IM SORRY <NAME> S HIS SON FROM <PLACE> I DONT KNOW HOW HE WOULD BE HERE AND <NAME> IS HIS NEPHEW HOW COULD <NAME> GET HERE THAT QUICK FROM <PLACE> <NAME> LIVES DOWN IN <NAME> COUNTRY RIGHT
Taylor5_LP,1843,0,Hostage_Taker,YEAH
Taylor5_LP,1844,0,Person,WELL HOW COULD HE POSSIBLY GET HERE
Taylor5_LP,1845,0,Hostage_Taker,<NAME> I MEAN <NAME> THIS HAPPENED THREE HOURS AGO
Taylor5_LP,1846,0,Person,YEAH BUT STILL <NAME> IT TOOK US AN HOUR AND A HALF TWO HOURS GET HERE BY
Taylor5_LP,1847,0,Hostage_Taker,HE CALLED I DIDNT ANSWER THE PHONE I DONT KNOW WHERE HE WAS CALLING FROM I ASSUMED IT WAS AROUND HERE
Taylor5_LP,1848,0,Person,HE COULD NEVER EVEN THE WAY THE TRAFFIC WAS BUILDING AND WAS THE ESCORTS IT WAS UNBELIEVABLE
Taylor5_LP,1849,0,Hostage_Taker,<NAME> THERE
Taylor5_LP,1850,0,Person,SOMEBODYS GOING TO LOOK FOR HIM
Taylor5_LP,1851,0,Hostage_Taker,WHERES <NAME>
Taylor5_LP,1852,0,Person,<NAME> IS OUTSIDE IN THE AMBULANCE WITH TWO OF MY FELLOWS I BELIEVE <NAME> AND <NAME> <NAME> TOLD ME SHES RIGHT OUTSIDE I DONT EVEN KNOW IF THIS FELLOWS IS YOU NAME <NAME> HIS LAST NAME IS <NAME>
Taylor5_LP,1853,0,Hostage_Taker,DID YOU TELL HIM HOW LONG THE LAST ONE TOOK
Taylor5_LP,1854,2,Person,NINETEEN HOURS HE WANTS ME TO MAKE SURE YOU KNOW THE LAST TIME IT TOOK NINETEEN HOURS LET ME TELL YOU SOMETHING <NAME> I WAS ONLY TWENTY EIGHT YEARS OLD THEN YOU CANT DO THIS TO ME THIS TIME
Taylor5_LP,1855,0,Hostage_Taker,I KNOW <NAME> I DONT WANNA PUT YOU THROUGH THIS
Taylor5_LP,1856,0,Person,AND I WAS OUT IN THE HOT SUN
Taylor5_LP,1857,0,Hostage_Taker,ALL I CALLED YOU FOR WAS TO THANK YOU FOR THE FRIENDSHIP OF ALL THESE YEARS I DIDNT WANT TO GET YOU INVOLVED IN THIS
Taylor5_LP,1858,0,Person,WELL IM INVOLVED NOW
Taylor5_LP,1859,0,Hostage_Taker,BECAUSE YOURE WHAT PEOPLE CALL A FRIEND A REAL FRIEND NOT A WEATHER FRIEND YOURE SOMEBODY THAT STICKS BY SOMEBODY
Taylor5_LP,1860,0,Person,AND IM HERE TO HELP YOU TODAY AND SO IS THIS FELLA <NAME>
Taylor5_LP,1861,0,Hostage_Taker,ITS NOT GONNA BE DONE BY SHOOTING
Taylor5_LP,1862,0,Person,WELL THEYRE NOT NO MORE SHOOTING
Taylor5_LP,1863,0,Hostage_Taker,ITS NOT GONNA BE DONE BY SHOOTING
Taylor5_LP,1864,0,Person,IS IT QUIET OUT THERE
Taylor5_LP,1865,0,Hostage_Taker,NOR IS IT GONNA BE DONE BY CONNING ME
Taylor5_LP,1866,1,Person,WELL NOBODYS BEEN CONING YOU <NAME> I GAVE YOU A PROMISE THEYRE NOT GONNA CON YOU THIS FELLA <NAME> IS A NEGOTIATOR HES NOT THE ONE THATS GONNA CON YOU I THINK HES BEEN PRETTY FAIR AND STRAIGHT WANNA TALK TO HIM AGAIN
Taylor5_LP,1867,0,Hostage_Taker,NO
